{
  "$schema": "http://json-schema.org/draft-07/schema#",
  "title": "JSON-Plus-Markdown DocBook Schema",
  "type": "object",
  "required": ["title", "sections"],
  "properties": {
    "title": {
      "type": "string",
      "description": "Document title"
    },
    "sections": {
      "type": "array",
      "description": "Top-level sections",
      "items": {
        "type": "object",
        "required": ["title", "content"],
        "properties": {
          "title": {
            "type": "string",
            "description": "Section title"
          },
          "content": {
            "type": "array",
            "items": {
              "oneOf": [
                {
                  "type": "object",
                  "properties": {
                    "type": { "const": "paragraph" },
                    "text": { "type": "string", "description": "Markdown text content" }
                  },
                  "required": ["type", "text"],
                  "additionalProperties": false
                },
                {
                  "type": "object",
                  "properties": {
                    "type": { "const": "blockquote" },
                    "text": { "type": "string", "description": "Markdown blockquote content" }
                  },
                  "required": ["type", "text"],
                  "additionalProperties": false
                },
                {
                  "type": "object",
                  "properties": {
                    "type": { "const": "image" },
                    "src": { "type": "string", "format": "uri" },
                    "alt": { "type": "string" }
                  },
                  "required": ["type", "src"],
                  "additionalProperties": false
                },
                {
                  "type": "object",
                  "properties": {
                    "type": { "const": "table" },
                    "caption": { "type": "string" },
                    "headers": {
                      "type": "array",
                      "items": { "type": "string" }
                    },
                    "rows": {
                      "type": "array",
                      "items": {
                        "type": "array",
                        "items": { "type": "string" }
                      }
                    }
                  },
                  "required": ["type", "headers", "rows"],
                  "additionalProperties": false
                }
              ]
            }
          }
        },
        "additionalProperties": false
      }
    },
    "footnotes": {
      "type": "array",
      "items": {
        "type": "object",
        "required": ["id", "content"],
        "properties": {
          "id": { "type": "string" },
          "content": { "type": "string", "description": "Markdown content of the footnote" }
        },
        "additionalProperties": false
      }
    },
    "bibliography": {
      "type": "array",
      "items": {
        "type": "object",
        "required": ["id", "title", "authors"],
        "properties": {
          "id": { "type": "string" },
          "title": { "type": "string" },
          "authors": {
            "type": "array",
            "items": { "type": "string" }
          },
          "year": { "type": "string" },
          "publisher": { "type": "string" }
        },
        "additionalProperties": false
      }
    },
    "appendices": {
      "type": "array",
      "items": {
        "type": "object",
        "properties": {
          "title": { "type": "string" },
          "content": {
            "type": "array",
            "items": {
              "type": "object",
              "properties": {
                "type": { "const": "sectionNote" },
                "content": { "type": "string" }
              },
              "required": ["type", "content"],
              "additionalProperties": false
            }
          }
        },
        "required": ["title", "content"],
        "additionalProperties": false
      }
    }
  },
  "additionalProperties": false
}
