{
  "title": "Sample Article",
  "sections": [
    {
      "title": "Introduction",
      "content": [
        {
          "type": "paragraph",
          "text": "This is a *sample* article paragraph with a footnote.[^1]"
        }
      ]
    }
  ],
  "footnotes": [
    {
      "id": "fn1",
      "content": "Footnote content."
    }
  ],
  "bibliography": [
    {
      "id": "bib1",
      "title": "Reference Title",
      "authors": ["John Doe"],
      "year": "2023",
      "publisher": "Example Publisher"
    }
  ]
}
